<?xml version="1.0"?>
<!DOCTYPE HPCToolkitExperiment [
<!-- ******************************************************************** -->
<!-- HPCToolkit Experiment DTD						  -->
<!-- Version 2.2							  -->
<!-- ******************************************************************** -->
<!ELEMENT HPCToolkitExperiment (Header, (SecCallPathProfile|SecFlatProfile)*)>
<!ATTLIST HPCToolkitExperiment
	  version CDATA #REQUIRED>

  <!-- ****************************************************************** -->

  <!-- Info/NV: flexible name-value pairs: (n)ame; (t)ype; (v)alue -->
  <!ELEMENT Info (NV*)>
  <!ATTLIST Info
	    n CDATA #IMPLIED>
  <!ELEMENT NV EMPTY>
  <!ATTLIST NV
	    n CDATA #REQUIRED
	    t CDATA #IMPLIED
	    v CDATA #REQUIRED>

  <!-- ****************************************************************** -->
  <!-- Header								  -->
  <!-- ****************************************************************** -->
  <!ELEMENT Header (Info*)>
  <!ATTLIST Header
	    n CDATA #REQUIRED>

  <!-- ****************************************************************** -->
  <!-- Section Header							  -->
  <!-- ****************************************************************** -->
  <!ELEMENT SecHeader (MetricTable?, MetricDBTable?, TraceDBTable?, LoadModuleTable?, FileTable?, ProcedureTable?, Info*)>

    <!-- MetricTable: -->
    <!ELEMENT MetricTable (Metric)*>

    <!-- Metric: (i)d; (n)ame -->
    <!--   o: metric sequence order (hpcrun metric order) -->
    <!--   md: metric description -->
    <!--   mp: metric parent ID   -->
    <!--   es: number of samples    (perf_events only) -->
    <!--   em: event multiplexed    (perf_events only) -->
    <!--   ep: average event period (perf_events only) -->
    <!--   (v)alue-type: transient type of values -->
    <!--   (t)ype: persistent type of metric      -->
    <!--   fmt: format; show; -->
    <!ELEMENT Metric (MetricFormula*, Info?)>
    <!ATTLIST Metric
	      i            CDATA #REQUIRED
	      o	           CDATA #IMPLIED
	      n            CDATA #REQUIRED
	      md	       CDATA #IMPLIED
	      mp	       CDATA #IMPLIED
	      es	       CDATA #IMPLIED
	      em	       CDATA #IMPLIED
	      ep	       CDATA #IMPLIED
	      v            (raw|final|derived-incr|derived) "raw"
	      t            (inclusive|exclusive|nil) "nil"
	      partner      CDATA #IMPLIED
	      fmt          CDATA #IMPLIED
	      show         (1|0) "1"
	      show-percent (1|0) "1">

    <!-- MetricFormula represents derived metrics: (t)ype; (frm): formula -->
    <!ELEMENT MetricFormula (Info?)>
    <!ATTLIST MetricFormula
	      t   (combine|finalize|view) "finalize"
	      i   CDATA #IMPLIED
	      frm CDATA #REQUIRED>

    <!-- Metric data, used in sections: (n)ame [from Metric]; (v)alue -->
    <!ELEMENT M EMPTY>
    <!ATTLIST M
	      n CDATA #REQUIRED
	      v CDATA #REQUIRED>

    <!-- MetricDBTable: -->
    <!ELEMENT MetricDBTable (MetricDB)*>

    <!-- MetricDB: (i)d; (n)ame -->
    <!--   (t)ype: persistent type of metric -->
    <!--   db-glob:        file glob describing files in metric db -->
    <!--   db-id:          id within metric db -->
    <!--   db-num-metrics: number of metrics in db -->
    <!--   db-header-sz:   size (in bytes) of a db file header -->
    <!ELEMENT MetricDB EMPTY>
    <!ATTLIST MetricDB
	      i              CDATA #REQUIRED
	      n              CDATA #REQUIRED
	      t              (inclusive|exclusive|nil) "nil"
	      partner        CDATA #IMPLIED
	      db-glob        CDATA #IMPLIED
	      db-id          CDATA #IMPLIED
	      db-num-metrics CDATA #IMPLIED
	      db-header-sz   CDATA #IMPLIED>

    <!-- TraceDBTable: -->
    <!ELEMENT TraceDBTable (TraceDB)>

    <!-- TraceDB: (i)d -->
    <!--   u: unit time of the trace (ms, ns, ..) -->
    <!--   db-min-time: min beginning time stamp (global) -->
    <!--   db-max-time: max ending time stamp (global) -->
    <!ELEMENT TraceDB EMPTY>
    <!ATTLIST TraceDB
	      i            CDATA #REQUIRED
	      u            CDATA #IMPLIED
	      db-glob      CDATA #IMPLIED
	      db-min-time  CDATA #IMPLIED
	      db-max-time  CDATA #IMPLIED
	      db-header-sz CDATA #IMPLIED>

    <!-- LoadModuleTable assigns a short name to a load module -->
    <!ELEMENT LoadModuleTable (LoadModule)*>

    <!ELEMENT LoadModule (Info?)>
    <!ATTLIST LoadModule
	      i CDATA #REQUIRED
	      n CDATA #REQUIRED>

    <!-- FileTable assigns a short name to a file -->
    <!ELEMENT FileTable (File)*>

    <!ELEMENT File (Info?)>
    <!ATTLIST File
	      i CDATA #REQUIRED
	      n CDATA #REQUIRED>

    <!-- ProcedureTable assigns a short name to a procedure -->
    <!ELEMENT ProcedureTable (Procedure)*>

    <!ELEMENT Procedure (Info?)>
    <!ATTLIST Procedure
	      i CDATA #REQUIRED
	      n CDATA #REQUIRED>

  <!-- ****************************************************************** -->
  <!-- Section: Call path profile					  -->
  <!-- ****************************************************************** -->
  <!ELEMENT SecCallPathProfile (SecHeader, SecCallPathProfileData)>
  <!ATTLIST SecCallPathProfile
	    i CDATA #REQUIRED
	    n CDATA #REQUIRED>

    <!ELEMENT SecCallPathProfileData (PF|M)*>
      <!-- Procedure frame -->
      <!--   (i)d: unique identifier for cross referencing -->
      <!--   (s)tatic scope id -->
      <!--   (n)ame: a string or an id in ProcedureTable -->
      <!--   (lm) load module: a string or an id in LoadModuleTable -->
      <!--   (f)ile name: a string or an id in LoadModuleTable -->
      <!--   (l)ine range: "beg-end" (inclusive range) -->
      <!--   (a)lien: whether frame is alien to enclosing P -->
      <!--   (str)uct: hpcstruct node id -->
      <!--   (v)ma-range-set: "{[beg-end), [beg-end)...}" -->
      <!ELEMENT PF (PF|Pr|L|C|S|M)*>
      <!ATTLIST PF
		i  CDATA #IMPLIED
		s  CDATA #IMPLIED
		n  CDATA #REQUIRED
		lm CDATA #IMPLIED
		f  CDATA #IMPLIED
		l  CDATA #IMPLIED
		str  CDATA #IMPLIED
		v  CDATA #IMPLIED>
      <!-- Procedure (static): GOAL: replace with 'P' -->
      <!ELEMENT Pr (Pr|L|C|S|M)*>
      <!ATTLIST Pr
                i  CDATA #IMPLIED
		s  CDATA #IMPLIED
                n  CDATA #REQUIRED
		lm CDATA #IMPLIED
		f  CDATA #IMPLIED
                l  CDATA #IMPLIED
		a  (1|0) "0"
		str  CDATA #IMPLIED
		v  CDATA #IMPLIED>
      <!-- Callsite (a special StatementRange) -->
      <!ELEMENT C (PF|M)*>
      <!ATTLIST C
		i CDATA #IMPLIED
		s CDATA #IMPLIED
		l CDATA #IMPLIED
		str CDATA #IMPLIED
		v CDATA #IMPLIED>

  <!-- ****************************************************************** -->
  <!-- Section: Flat profile						  -->
  <!-- ****************************************************************** -->
  <!ELEMENT SecFlatProfile (SecHeader, SecFlatProfileData)>
  <!ATTLIST SecFlatProfile
	    i CDATA #REQUIRED
	    n CDATA #REQUIRED>

    <!ELEMENT SecFlatProfileData (LM|M)*>
      <!-- Load module: (i)d; (n)ame; (v)ma-range-set -->
      <!ELEMENT LM (F|P|M)*>
      <!ATTLIST LM
                i CDATA #IMPLIED
                n CDATA #REQUIRED
		v CDATA #IMPLIED>
      <!-- File -->
      <!ELEMENT F (P|L|S|M)*>
      <!ATTLIST F
                i CDATA #IMPLIED
                n CDATA #REQUIRED>
      <!-- Procedure (Note 1) -->
      <!ELEMENT P (P|A|L|S|C|M)*>
      <!ATTLIST P
                i CDATA #IMPLIED
                n CDATA #REQUIRED
                l CDATA #IMPLIED
		str CDATA #IMPLIED
		v CDATA #IMPLIED>
      <!-- Alien (Note 1) -->
      <!ELEMENT A (A|L|S|C|M)*>
      <!ATTLIST A
                i CDATA #IMPLIED
                f CDATA #IMPLIED
                n CDATA #IMPLIED
                l CDATA #IMPLIED
		str CDATA #IMPLIED
		v CDATA #IMPLIED>
      <!-- Loop (Note 1,2) -->
      <!ELEMENT L (A|Pr|L|S|C|M)*>
      <!ATTLIST L
		i CDATA #IMPLIED
		s CDATA #IMPLIED
		l CDATA #IMPLIED
	        f CDATA #IMPLIED
		str CDATA #IMPLIED
		v CDATA #IMPLIED>
      <!-- Statement (Note 2) -->
      <!--   (it): trace record identifier -->
      <!ELEMENT S (S|M)*>
      <!ATTLIST S
		i  CDATA #IMPLIED
		it CDATA #IMPLIED
		s  CDATA #IMPLIED
		l  CDATA #IMPLIED
		str  CDATA #IMPLIED
		v  CDATA #IMPLIED>
      <!-- Note 1: Contained Cs may not contain PFs -->
      <!-- Note 2: The 's' attribute is not used for flat profiles -->
]>
<HPCToolkitExperiment version="2.2">
<Header n="driver">
  <Info/>
</Header>
<SecCallPathProfile i="0" n="driver">
<SecHeader>
  <MetricTable>
    <Metric i="2" n="CPUTIME (sec):Sum (I)" o="0" v="derived-incr" md="CPUTIME (sec)" em="0" es="0" ep="-9223372036854775808" t="inclusive" partner="3" show="1" show-percent="1">
      <MetricFormula t="combine" frm="sum($2, $2)"/>
      <MetricFormula t="finalize" frm="$2"/>
      <Info><NV n="units" v="events"/></Info>
    </Metric>
    <Metric i="3" n="CPUTIME (sec):Sum (E)" o="-1" v="derived-incr" md="CPUTIME (sec)" em="0" es="0" ep="-9223372036854775808" t="exclusive" partner="2" show="1" show-percent="1">
      <MetricFormula t="combine" frm="sum($3, $3)"/>
      <MetricFormula t="finalize" frm="$3"/>
      <Info><NV n="units" v="events"/></Info>
    </Metric>
  </MetricTable>
  <MetricDBTable>
    <MetricDB i="0" n="CPUTIME (sec) (I)" t="inclusive" partner="1" db-glob="*.metric-db" db-id="0" db-num-metrics="2" db-header-sz="24"/>
    <MetricDB i="1" n="CPUTIME (sec) (E)" t="exclusive" partner="0" db-glob="*.metric-db" db-id="1" db-num-metrics="2" db-header-sz="24"/>
  </MetricDBTable>
  <LoadModuleTable>
    <LoadModule i="2" n="/homes/cmsc714-1vef/cmsc714project-main/lide_c_dnnlayers/test_c/multiMLP/driver"/>
    <LoadModule i="1265" n="/software/spack-software/2020.05.14/linux-rhel8-ivybridge/gcc-8.4.0/hpctoolkit-2020.03.01-wih3ztasqfu3d5hbfh6sl5j2ave3kcjt/lib/hpctoolkit/ext-libs/libmonitor.so.0.0.0"/>
    <LoadModule i="1269" n="/software/spack-software/2020.05.14/linux-rhel8-x86_64/gcc-rh8-8.3.1/gcc-8.4.0-vblibp6qsuo6rbkdn6femxo5kcfnwvry/lib64/libstdc++.so.6.0.25"/>
    <LoadModule i="1315" n="/usr/lib64/libc-2.28.so"/>
  </LoadModuleTable>
  <FileTable>
    <File i="3" n="./src/homes/cmsc714-1vef/cmsc714project-main/lide_c_dnnlayers/actor/lide_c_headDense.c"/>
    <File i="92" n="./src/homes/cmsc714-1vef/cmsc714project-main/lide_c_dnnlayers/actor/lide_c_read1D.c"/>
    <File i="151" n="./src/homes/cmsc714-1vef/cmsc714project-main/lide_c_dnnlayers/graph/lide_c_multiMLP_graph.c"/>
    <File i="256" n="./src/homes/cmsc714-1vef/cmsc714project-main/nn_c/dense.c"/>
    <File i="387" n="./src/homes/cmsc714-1vef/cmsc714project-main/nn_c/read1D.cpp"/>
    <File i="957" n="&lt;unknown file&gt; [driver]"/>
    <File i="1266" n="&lt;unknown file&gt; [libmonitor.so.0.0.0]"/>
    <File i="1270" n="&lt;unknown file&gt; [libstdc++.so.6.0.25]"/>
    <File i="1316" n="C-name.c"/>
  </FileTable>
  <ProcedureTable>
    <Procedure i="40" n="lide_c_headDense_invoke(_lide_c_headDense_context_struct*)" v="0x40273f"/>
    <Procedure i="121" n="lide_c_read1D_invoke(_lide_c_read1D_context_struct*)" v="0x402a81"/>
    <Procedure i="250" n="lide_c_multiMLP_graph_scheduler(_lide_c_multiMLP_graph_context_struct*)" v="0x40203c"/>
    <Procedure i="317" n="forwardD(unsigned int, float*, float*, float*, unsigned int, unsigned int)" v="0x40363d"/>
    <Procedure i="356" n="headDenserunD(HEADDENSESTATE*, unsigned int, unsigned int, unsigned int, float*)" v="0x4038ce"/>
    <Procedure i="399" n="Read1D::readExecute()" v="0x403a74"/>
    <Procedure i="1051" n="main" v="0x401842"/>
    <Procedure i="1065" n="lide_c_util_guarded_execution" v="0x40211d"/>
    <Procedure i="1069" n="lide_c_util_simple_scheduler" v="0x402161"/>
    <Procedure i="1267" n="&lt;program root&gt;" f="1" v="0"/>
    <Procedure i="1271" n="std::getline&lt;char, std::char_traits&lt;char&gt;, std::allocator&lt;char&gt; &gt;(std::basic_istream&lt;char, std::char_traits&lt;char&gt; &gt;&amp;, std::__cxx11::basic_string&lt;char, std::char_traits&lt;char&gt;, std::allocator&lt;char&gt; &gt;&amp;, char)" v="0"/>
    <Procedure i="1273" n="std::__cxx11::basic_string&lt;char, std::char_traits&lt;char&gt;, std::allocator&lt;char&gt; &gt;::_M_append(char const*, unsigned long)" v="0"/>
    <Procedure i="1275" n="std::__cxx11::basic_stringstream&lt;char, std::char_traits&lt;char&gt;, std::allocator&lt;char&gt; &gt;::basic_stringstream(std::__cxx11::basic_string&lt;char, std::char_traits&lt;char&gt;, std::allocator&lt;char&gt; &gt; const&amp;, std::_Ios_Openmode)" v="0"/>
    <Procedure i="1277" n="std::basic_ios&lt;char, std::char_traits&lt;char&gt; &gt;::init(std::basic_streambuf&lt;char, std::char_traits&lt;char&gt; &gt;*)" v="0"/>
    <Procedure i="1279" n="std::basic_ios&lt;char, std::char_traits&lt;char&gt; &gt;::_M_cache_locale(std::locale const&amp;)" v="0"/>
    <Procedure i="1281" n="std::has_facet&lt;std::ctype&lt;char&gt; &gt;(std::locale const&amp;)" v="0"/>
    <Procedure i="1283" n="__dynamic_cast" v="0"/>
    <Procedure i="1285" n="__cxxabiv1::__vmi_class_type_info::__do_dyncast(long, __cxxabiv1::__class_type_info::__sub_kind, __cxxabiv1::__class_type_info const*, void const*, __cxxabiv1::__class_type_info const*, void const*, __cxxabiv1::__class_type_info::__dyncast_result&amp;) const" v="0"/>
    <Procedure i="1287" n="std::has_facet&lt;std::num_get&lt;char, std::istreambuf_iterator&lt;char, std::char_traits&lt;char&gt; &gt; &gt; &gt;(std::locale const&amp;)" v="0"/>
    <Procedure i="1289" n="std::locale::id::_M_id() const" v="0"/>
    <Procedure i="1291" n="std::has_facet&lt;std::num_put&lt;char, std::ostreambuf_iterator&lt;char, std::char_traits&lt;char&gt; &gt; &gt; &gt;(std::locale const&amp;)" v="0"/>
    <Procedure i="1293" n="std::use_facet&lt;std::num_put&lt;char, std::ostreambuf_iterator&lt;char, std::char_traits&lt;char&gt; &gt; &gt; &gt;(std::locale const&amp;)" v="0"/>
    <Procedure i="1295" n="__cxxabiv1::__si_class_type_info::__do_dyncast(long, __cxxabiv1::__class_type_info::__sub_kind, __cxxabiv1::__class_type_info const*, void const*, __cxxabiv1::__class_type_info const*, void const*, __cxxabiv1::__class_type_info::__dyncast_result&amp;) const" v="0"/>
    <Procedure i="1297" n="std::ios_base::_M_init()" v="0"/>
    <Procedure i="1299" n="std::locale::locale()" v="0"/>
    <Procedure i="1301" n="std::use_facet&lt;std::ctype&lt;char&gt; &gt;(std::locale const&amp;)" v="0"/>
    <Procedure i="1303" n="_ZNKSt6locale2id5_M_idEv@plt" v="0"/>
    <Procedure i="1305" n="std::basic_istream&lt;char, std::char_traits&lt;char&gt; &gt;::_M_extract&lt;float&gt;(float&amp;)" v="0"/>
    <Procedure i="1307" n="std::num_get&lt;char, std::istreambuf_iterator&lt;char, std::char_traits&lt;char&gt; &gt; &gt;::do_get(std::istreambuf_iterator&lt;char, std::char_traits&lt;char&gt; &gt;, std::istreambuf_iterator&lt;char, std::char_traits&lt;char&gt; &gt;, std::ios_base&amp;, std::_Ios_Iostate&amp;, float&amp;) const" v="0"/>
    <Procedure i="1309" n="std::num_get&lt;char, std::istreambuf_iterator&lt;char, std::char_traits&lt;char&gt; &gt; &gt;::_M_extract_float(std::istreambuf_iterator&lt;char, std::char_traits&lt;char&gt; &gt;, std::istreambuf_iterator&lt;char, std::char_traits&lt;char&gt; &gt;, std::ios_base&amp;, std::_Ios_Iostate&amp;, std::basic_string&lt;char, std::char_traits&lt;char&gt;, std::allocator&lt;char&gt; &gt;&amp;) const" v="0"/>
    <Procedure i="1311" n="std::__convert_to_v&lt;float&gt;(char const*, float&amp;, std::_Ios_Iostate&amp;, __locale_struct* const&amp;)" v="0"/>
    <Procedure i="1313" n="std::__cxx11::basic_stringstream&lt;char, std::char_traits&lt;char&gt;, std::allocator&lt;char&gt; &gt;::~basic_stringstream()" v="0"/>
    <Procedure i="1317" n="__strcmp_sse2_unaligned" v="0"/>
    <Procedure i="1319" n="____strtof_l_internal" v="0"/>
  </ProcedureTable>
  <Info/>
</SecHeader>
<SecCallPathProfileData>
<M n="2" v="0.172147"/>
<PF i="2" s="1267" l="0" lm="1265" f="1266" n="1267">
<M n="2" v="0.172147"/>
<C i="3" s="1268" l="0" v="0xdaca">
<M n="2" v="0.172147"/>
<PF i="4" s="1051" l="0" lm="2" f="957" n="1051">
<M n="2" v="0.172147"/>
<C i="5" s="1054" l="0" v="0x4018f4">
<M n="2" v="0.172147"/>
<PF i="6" s="250" l="168" lm="2" f="151" n="250">
<M n="2" v="0.172147"/>
<C i="7" s="255" l="169" v="0x402068">
<M n="2" v="0.172147"/>
<PF i="8" s="1069" l="0" lm="2" f="957" n="1069">
<M n="2" v="0.172147"/>
<L i="9" s="1071" l="0" f="957" v="0x402182">
<M n="2" v="0.172147"/>
<L i="10" s="1073" l="0" f="957" v="0x4021d2">
<M n="2" v="0.172147"/>
<C i="11" s="1075" l="0" v="0x4021cb">
<M n="2" v="0.172147"/>
<PF i="12" s="1065" l="0" lm="2" f="957" n="1065">
<M n="2" v="0.172147"/>
<C i="13" s="1068" l="0" v="0x402153">
<M n="2" v="0.172147"/>
<PF i="14" s="40" l="114" lm="2" f="3" n="40">
<M n="2" v="0.017811"/>
<C i="15" s="81" l="150" v="0x4028e3">
<M n="2" v="0.017811"/>
<PF i="16" s="356" l="133" lm="2" f="256" n="356">
<M n="2" v="0.017811"/>
<C i="17" s="361" l="138" v="0x403911">
<M n="2" v="0.017811"/>
<PF i="18" s="317" l="77" lm="2" f="256" n="317">
<M n="2" v="0.017811"/><M n="3" v="0.017811"/>
<L i="19" s="322" l="80" f="256" v="0x403668">
<M n="2" v="0.017811"/>
<L i="20" s="325" l="81" f="256" v="0x40367b">
<M n="2" v="0.017811"/>
<L i="21" s="328" l="82" f="256" v="0x40368e">
<M n="2" v="0.017811"/><M n="3" v="0.017811"/>
<S i="22" s="330" l="83">
<M n="2" v="0.005855"/><M n="3" v="0.005855"/>
</S>
<S i="23" s="331" l="84">
<M n="2" v="0.011956"/><M n="3" v="0.011956"/>
</S>
</L>
</L>
</L>
</PF>
</C>
</PF>
</C>
</PF>
<PF i="24" s="121" l="84" lm="2" f="92" n="121">
<M n="2" v="0.154336"/>
<C i="25" s="134" l="91" v="0x402ac9">
<M n="2" v="0.154336"/>
<PF i="26" s="399" l="16" lm="2" f="387" n="399">
<M n="2" v="0.154336"/>
<L i="27" s="432" l="25" f="387" v="0x403b44">
<M n="2" v="0.154336"/>
<L i="28" s="443" l="28" f="387" v="0x403bb3">
<M n="2" v="0.154336"/>
<C i="29" s="452" l="29" v="0x403bec">
<M n="2" v="0.011872"/>
<PF i="30" s="1271" l="0" lm="1269" f="1270" n="1271">
<M n="2" v="0.011872"/><M n="3" v="0.005976"/>
<C i="31" s="1272" l="0" v="0xb2de3">
<M n="2" v="0.005896"/>
<PF i="32" s="1273" l="0" lm="1269" f="1270" n="1273">
<M n="2" v="0.005896"/><M n="3" v="0.005896"/>
<S i="33" s="1274" l="0">
<M n="2" v="0.005896"/><M n="3" v="0.005896"/>
</S>
</PF>
</C>
<S i="34" s="1272" l="0">
<M n="2" v="0.005976"/><M n="3" v="0.005976"/>
</S>
</PF>
</C>
<C i="35" s="454" l="30" v="0x403c16">
<M n="2" v="0.112906"/>
<PF i="36" s="1275" l="0" lm="1269" f="1270" n="1275">
<M n="2" v="0.112906"/>
<C i="37" s="1276" l="0" v="0x11db0d">
<M n="2" v="0.017626"/>
<PF i="38" s="1277" l="0" lm="1269" f="1270" n="1277">
<M n="2" v="0.017626"/>
<C i="39" s="1278" l="0" v="0xfbfc0">
<M n="2" v="0.017626"/>
<PF i="40" s="1279" l="0" lm="1269" f="1270" n="1279">
<M n="2" v="0.017626"/>
<C i="41" s="1280" l="0" v="0xfbb94">
<M n="2" v="0.005752"/>
<PF i="42" s="1281" l="0" lm="1269" f="1270" n="1281">
<M n="2" v="0.005752"/>
<C i="43" s="1282" l="0" v="0x108060">
<M n="2" v="0.005752"/>
<PF i="44" s="1283" l="0" lm="1269" f="1270" n="1283">
<M n="2" v="0.005752"/>
<C i="45" s="1284" l="0" v="0x98e26">
<M n="2" v="0.005752"/>
<PF i="46" s="1285" l="0" lm="1269" f="1270" n="1285">
<M n="2" v="0.005752"/>
<C i="47" s="1286" l="0" v="0x9bef0">
<M n="2" v="0.005752"/>
<PF i="48" s="1317" l="0" lm="1315" f="1316" n="1317">
<M n="2" v="0.005752"/><M n="3" v="0.005752"/>
<S i="49" s="1318" l="0">
<M n="2" v="0.005752"/><M n="3" v="0.005752"/>
</S>
</PF>
</C>
</PF>
</C>
</PF>
</C>
</PF>
</C>
<C i="50" s="1280" l="0" v="0xfbbca">
<M n="2" v="0.011874"/>
<PF i="51" s="1287" l="0" lm="1269" f="1270" n="1287">
<M n="2" v="0.011874"/>
<C i="52" s="1288" l="0" v="0x1081c0">
<M n="2" v="0.005947"/>
<PF i="53" s="1289" l="0" lm="1269" f="1270" n="1289">
<M n="2" v="0.005947"/><M n="3" v="0.005947"/>
<S i="54" s="1290" l="0">
<M n="2" v="0.005947"/><M n="3" v="0.005947"/>
</S>
</PF>
</C>
<C i="55" s="1288" l="0" v="0x1081f0">
<M n="2" v="0.005927"/>
<PF i="56" s="1283" l="0" lm="1269" f="1270" n="1283">
<M n="2" v="0.005927"/><M n="3" v="0.005927"/>
<S i="57" s="1284" l="0">
<M n="2" v="0.005927"/><M n="3" v="0.005927"/>
</S>
</PF>
</C>
</PF>
</C>
</PF>
</C>
</PF>
</C>
<C i="58" s="1276" l="0" v="0x11db2d">
<M n="2" v="0.023082"/>
<PF i="59" s="1277" l="0" lm="1269" f="1270" n="1277">
<M n="2" v="0.023082"/>
<C i="60" s="1278" l="0" v="0xfbfc0">
<M n="2" v="0.023082"/>
<PF i="61" s="1279" l="0" lm="1269" f="1270" n="1279">
<M n="2" v="0.023082"/>
<C i="62" s="1280" l="0" v="0xfbbaf">
<M n="2" v="0.005953"/>
<PF i="63" s="1291" l="0" lm="1269" f="1270" n="1291">
<M n="2" v="0.005953"/><M n="3" v="0.005953"/>
<S i="64" s="1292" l="0">
<M n="2" v="0.005953"/><M n="3" v="0.005953"/>
</S>
</PF>
</C>
<C i="65" s="1280" l="0" v="0xfbbbb">
<M n="2" v="0.005968"/>
<PF i="66" s="1293" l="0" lm="1269" f="1270" n="1293">
<M n="2" v="0.005968"/>
<C i="67" s="1294" l="0" v="0x10714b">
<M n="2" v="0.005968"/>
<PF i="68" s="1283" l="0" lm="1269" f="1270" n="1283">
<M n="2" v="0.005968"/><M n="3" v="0.005968"/>
<S i="69" s="1284" l="0">
<M n="2" v="0.005968"/><M n="3" v="0.005968"/>
</S>
</PF>
</C>
</PF>
</C>
<C i="70" s="1280" l="0" v="0xfbbca">
<M n="2" v="0.011161"/>
<PF i="71" s="1287" l="0" lm="1269" f="1270" n="1287">
<M n="2" v="0.011161"/>
<C i="72" s="1288" l="0" v="0x1081f0">
<M n="2" v="0.011161"/>
<PF i="73" s="1283" l="0" lm="1269" f="1270" n="1283">
<M n="2" v="0.011161"/>
<C i="74" s="1284" l="0" v="0x98e26">
<M n="2" v="0.011161"/>
<PF i="75" s="1295" l="0" lm="1269" f="1270" n="1295">
<M n="2" v="0.011161"/><M n="3" v="0.011161"/>
<S i="76" s="1296" l="0">
<M n="2" v="0.011161"/><M n="3" v="0.011161"/>
</S>
</PF>
</C>
</PF>
</C>
</PF>
</C>
</PF>
</C>
</PF>
</C>
<C i="77" s="1276" l="0" v="0x11dbfc">
<M n="2" v="0.072198"/>
<PF i="78" s="1277" l="0" lm="1269" f="1270" n="1277">
<M n="2" v="0.072198"/>
<C i="79" s="1278" l="0" v="0xfbfb1">
<M n="2" v="0.005866"/>
<PF i="80" s="1297" l="0" lm="1269" f="1270" n="1297">
<M n="2" v="0.005866"/>
<C i="81" s="1298" l="0" v="0xaaf3d">
<M n="2" v="0.005866"/>
<PF i="82" s="1299" l="0" lm="1269" f="1270" n="1299">
<M n="2" v="0.005866"/><M n="3" v="0.005866"/>
<S i="83" s="1300" l="0">
<M n="2" v="0.005866"/><M n="3" v="0.005866"/>
</S>
</PF>
</C>
</PF>
</C>
<C i="84" s="1278" l="0" v="0xfbfc0">
<M n="2" v="0.066332"/>
<PF i="85" s="1279" l="0" lm="1269" f="1270" n="1279">
<M n="2" v="0.066332"/><M n="3" v="0.060464"/>
<C i="86" s="1280" l="0" v="0xfbba0">
<M n="2" v="0.005868"/>
<PF i="87" s="1301" l="0" lm="1269" f="1270" n="1301">
<M n="2" v="0.005868"/>
<C i="88" s="1302" l="0" v="0x1065a0">
<M n="2" v="0.005868"/>
<PF i="89" s="1303" l="0" lm="1269" f="1270" n="1303">
<M n="2" v="0.005868"/><M n="3" v="0.005868"/>
<S i="90" s="1304" l="0">
<M n="2" v="0.005868"/><M n="3" v="0.005868"/>
</S>
</PF>
</C>
</PF>
</C>
<S i="91" s="1280" l="0">
<M n="2" v="0.060464"/><M n="3" v="0.060464"/>
</S>
</PF>
</C>
</PF>
</C>
</PF>
</C>
<C i="92" s="455" l="30" v="0x403c7d">
<M n="2" v="0.00598"/>
<PF i="93" s="1313" l="0" lm="1269" f="1270" n="1313">
<M n="2" v="0.00598"/><M n="3" v="0.00598"/>
<S i="94" s="1314" l="0">
<M n="2" v="0.00598"/><M n="3" v="0.00598"/>
</S>
</PF>
</C>
<C i="95" s="456" l="32" v="0x403c2f">
<M n="2" v="0.023578"/>
<PF i="96" s="1305" l="0" lm="1269" f="1270" n="1305">
<M n="2" v="0.023578"/>
<C i="97" s="1306" l="0" v="0x100760">
<M n="2" v="0.023578"/>
<PF i="98" s="1307" l="0" lm="1269" f="1270" n="1307">
<M n="2" v="0.023578"/>
<C i="99" s="1308" l="0" v="0x10d507">
<M n="2" v="0.011852"/>
<PF i="100" s="1309" l="0" lm="1269" f="1270" n="1309">
<M n="2" v="0.011852"/><M n="3" v="0.011852"/>
<S i="101" s="1310" l="0">
<M n="2" v="0.011852"/><M n="3" v="0.011852"/>
</S>
</PF>
</C>
<C i="102" s="1308" l="0" v="0x10d53b">
<M n="2" v="0.011726"/>
<PF i="103" s="1311" l="0" lm="1269" f="1270" n="1311">
<M n="2" v="0.011726"/>
<C i="104" s="1312" l="0" v="0xbad6e">
<M n="2" v="0.011726"/>
<PF i="105" s="1319" l="0" lm="1315" f="1316" n="1319">
<M n="2" v="0.011726"/><M n="3" v="0.011726"/>
<S i="106" s="1320" l="0">
<M n="2" v="0.011726"/><M n="3" v="0.011726"/>
</S>
</PF>
</C>
</PF>
</C>
</PF>
</C>
</PF>
</C>
</L>
</L>
</PF>
</C>
</PF>
</C>
</PF>
</C>
</L>
</L>
</PF>
</C>
</PF>
</C>
</PF>
</C>
</PF>
</SecCallPathProfileData>
</SecCallPathProfile>
</HPCToolkitExperiment>
